Hotel_ID,Review Date,Location,Hotel/Restaurant name,Review
rn558551124,"Reviewed February 5, 2018 ", Kata Beach,Madras Cafe,"This place is heaven for vegetarians in phuket... Here you will get authentic Indian food and Indian flavour... This place is just mind blowing.. One doesn't need to think twice before ordering as
1.there are other places where veg food is offered but there are...More"
rn557733302,"Reviewed February 1, 2018 ", Kata Beach,Madras Cafe,Best indian restaurant in patong. U get the feeling of having food like you are having at your home..
rn557705352,"Reviewed February 1, 2018 ", Kata Beach,Madras Cafe,"Food was excelente, were not expecting this good in pantong, recommend . Going for dinner also. Thanks"
rn557559528,"Reviewed January 31, 2018 ", Kata Beach,Madras Cafe,This is the best place to have jain food in town. They really know the Indian taste. Plus good staff and quick service
rn557283161,"Reviewed January 30, 2018 ", Kata Beach,Madras Cafe,I visited on the 29th jan and the food and service was superb.... the staff behaviour was also great
rn556503432,"Reviewed January 26, 2018 ", Kata Beach,Madras Cafe,"This hotel doesnt even have a AC room. Idly is very bad, same with Poori. Quantity is very less. I seriously dont understand what makes things very costly there."
rn554786160,"Reviewed January 19, 2018 ", Kata Beach,Madras Cafe,"Centrally located and very good for Indian people, special for Jain foodies also, they have different preparation for Jain Food.
Staff is friendly and good atmosphere.
Indian song makes the environment more pleasant."
rn554398545,"Reviewed January 17, 2018 ", Kata Beach,Madras Cafe,Madras cafe was the only one we found having vegetarian food with best taste exactly matching Indian taste
rn554325729,"Reviewed January 16, 2018 ", Kata Beach,Madras Cafe,"Very good Indian food but mediocre ambience hence only two / three tables were occupied out of the 20 or so !
This restaurant has a great location very near Jungceylon Mall and Bangla Road .
It also had an upstairs area which was not...More"
rn553925233,"Reviewed January 15, 2018 ", Kata Beach,Madras Cafe,"I had a takeaway of Chicken Biryani from here, it was very average and could have been better. The chicken pieces were not tender and difficult to chew.
There are other better tasting Indian cuisine rest."
rn552890480,"Reviewed January 10, 2018 ", Kata Beach,Madras Cafe,Good dosa should eat hear. Real Indian taste should come hear. Food other also available. Near my hotel
rn552480303,"Reviewed January 8, 2018 ", Kata Beach,Madras Cafe,"Best in town Indian food.
South Indian food is superb.. Yummy
Dal Makhni also too tasty
Pure veg food"
rn551769196,"Reviewed January 5, 2018 ", Kata Beach,Madras Cafe,"Fabulous dinner at Madras Cafe in Patong Beach / Phuket.
Ordered Garlic naan, Basmati rice, Sag Aloo, Chicken Tikka Masala & Chicken Korma.
All was served perfect and 10/10 in flavour.
Would you like to taste good Indian food ?
Don't miss out on this...More"
rn551487728,"Reviewed January 4, 2018 ", Kata Beach,Madras Cafe,This place has got decent food but keep a close look on your order and what you get. 2 times out somebody's order was brought to our tables. Mostly the reason being that this place is highly short of staff. You can go there if...More
rn550861941,"Reviewed January 2, 2018 ", Kata Beach,Madras Cafe,There are more than one outlets of Madras Cafe. We have tried two of them. We liked the one opposite to Jungceylon Mall. We tried south Indian and north indian items and taste was good. Service was better than other Indian restaurants. Owner looked bit...More
rn550529727,"Reviewed December 31, 2017 ", Kata Beach,Madras Cafe,The food was really enjoyable and I would have given 5 stars only if the portion was not small for the starters
rn550415030,"Reviewed December 31, 2017 ", Kata Beach,Madras Cafe,"They seem to be there in the market for Indian food for long but, just because they have become famous, they have not retained the quality of food and service which they had for a long time. Though their brand is built they have not...More"
rn550120791,"Reviewed December 29, 2017 ", Kata Beach,Madras Cafe,Been here thrice on our 5 day trip to phuket. The food is amazing. We had south indian and north indian. Service is great too. All in all a must visit if you are craving for jndian in phuket !!
rn549890961,"Reviewed December 28, 2017 ", Kata Beach,Madras Cafe,"When you r craving for Indian veg food in Phuket then visit this place.awesome food tastes Indian
Food makes us happy..."
rn549877705,"Reviewed December 28, 2017 ", Kata Beach,Madras Cafe,Read about the great reviews and craving for a good south indian meal so walked in at 2 pm . Surprising 1 table only occupied and all the 3 staff watching a movie on in the tv in the restaurant. Big menu wth north indian...More
rn549506635,"Reviewed December 27, 2017 ", Kata Beach,Madras Cafe,"I came here in hopes of having authentic Indian food, I was underwhelmed by the food. I ordered chicken pakora as an appetizer and the chicken was raw. I sent it back and it didn’t come out until our main course was there. The butter...More"
rn549408968,"Reviewed December 26, 2017 ", Kata Beach,Madras Cafe,"When we googled we found it is a vegetarian Indian restaurant and when we visited we found it served both the food, still we tried there Punjabi dish. The quantity was so less with high prices and the taste was not at all good, we...More"
rn549346048,"Reviewed December 26, 2017 ", Kata Beach,Madras Cafe,"We ordered a dosa, chettinad chicken, puri set, butter naan and masala papad. The chettinad chicken had no salt, no flavour and the chicken was uncooked. The sambhar served with dosa was like hot water. The butter naan was chewy like a rubber. After ordering,...More"
rn549200127,"Reviewed December 25, 2017 ", Kata Beach,Madras Cafe,"By Indian standards, average Indian food especially in taste. You can’t fault them in quantity though. Adequate portions. The soda and the bhajiyas / pakodas were good so it must be a South Indian chef. The North Indian dishes were poorly seasoned, not spicy and...More"
rn549002238,"Reviewed December 24, 2017 ", Kata Beach,Madras Cafe,"I visited this place around 12am and they were courteous enough to serve tasty masala Dosa & Rice with rasam...
Wide choice of food evident in the menu... Indian consumers may feel the pricing is on higher side but it is worth paying for a...More"
rn548637490,"Reviewed December 22, 2017 ", Kata Beach,Madras Cafe,Food is hit or miss. First time chutney was stale. Second time it was better. Serves very little chutney and charges for extra. Tries to give lots of coins and old / worn out notes so that you leave it as tip.
rn548620884,"Reviewed December 22, 2017 ", Kata Beach,Madras Cafe,We visited on 20th Dec. South indian food is excellent. Try this restaurent if u r staying in Patong. Very good choice
rn548606881,"Reviewed December 22, 2017 ", Kata Beach,Madras Cafe,"This is a good place for Indian food and is close to action in Patong near Bangla street. They did take few extra minutes, however the quality of food compensated for extra time"
rn548210957,"Reviewed December 20, 2017 ", Kata Beach,Madras Cafe,We stayed in phuket for 3 days. This was the restaurant where i found good uvegetarian food. Near to market place. The only recommendation is to improve the delivery time. Rest all is very good.
rn548202172,"Reviewed December 20, 2017 ", Kata Beach,Madras Cafe,Me and my wife visited this place. Best place for authentic Indian food. Superb staff. We had a nice time here. Food is very delicious and Sambar is very very tasty.
rn548152236,"Reviewed December 19, 2017 ", Kata Beach,Madras Cafe,Every time we ordered something it had to be sent back to the kitchen because it always had some flies or insects in there sambhar or chutneys !! They took an hour to make simple stuff like idli sambhar and masala dosa!! Not recommended if...More
rn548146718,"Reviewed December 19, 2017 ", Kata Beach,Madras Cafe,"We ordered 1 masala dosa, 1 soft drink, 1 veg paneer kadhai sabzi, 1 garlic naan and 1 garlic cheese naan
What we liked: very good south Indian food, good north indian
What can be improved: service as slow (however there was a lot of...More"
rn547839369,"Reviewed December 18, 2017 ", Kata Beach,Madras Cafe,Closest to Indian taste I could get into in Phuket. We stayed 3 nights at Patong and had 2 means from Madras cafe. Bit expensive compared to local restaurants because of Indian food and spices! Rest all is good !
rn547628964,"Reviewed December 17, 2017 ", Kata Beach,Madras Cafe,"Phuket is one of my favorite destinations and this place in Patong is one of the best restaurants.
They have amazing following items you should really look to take while choosing to have Indian food
1. Masala dosa
2. Mix pakoda and Paneer pakoda
3....More"
rn546964384,"Reviewed December 13, 2017 ", Kata Beach,Madras Cafe,If you are looking for a good Indian restaurant in Patong..your search ends here...nice ambience..courteous staff and delicious food..kudos team madras cafe..
rn546951409,"Reviewed December 13, 2017 ", Kata Beach,Madras Cafe,"The food was amazing and the place is open till 12 which is a good thing.
The staff was friendly and overall experience was awesome."
rn546784197,"Reviewed December 12, 2017 ", Kata Beach,Madras Cafe,If you are looking for best Indian food in patong.. Look no where further... Madras Cafe is your place... They serve the best Indian cuisine out here and it's just completely mouth watery.... Yum yum
rn546651378,"Reviewed December 11, 2017 ", Kata Beach,Madras Cafe,"The food at this restaurant is amazing! I had the butter chicken with basmati rice, garlic naan and some rayta and it was perfect!"
rn546403907,"Reviewed December 10, 2017 ", Kata Beach,Madras Cafe,"We had south Indian food at this reataurant. We ordered onion masala dosa and onion tomato utthapam. Food was nice and the service was also quick in comparison to other restaurants.
Keep up the good taste!"
rn546400500,"Reviewed December 10, 2017 ", Kata Beach,Madras Cafe,One of the best places to hv indian food while in patong !! Great food and great service !! Dosa made me feel I am not missing India at all and non veg was exceptionally great !
rn546380677,"Reviewed December 10, 2017 ", Kata Beach,Madras Cafe,This place serves amazing Indian Food... best restaurant if you want to have delicious Indian food.. don't miss it... 100 times better than other Indian restaurants in Patong..
rn545502901,"Reviewed December 6, 2017 ", Kata Beach,Madras Cafe,"Pathetic Service
Pathetic food
Overpriced
Very less quantity
Even complimentary salad is not there.
Onions and chutney are chargeable.<f0><U+009F><U+0091><U+00BF>"
rn545412386,"Reviewed December 5, 2017 ", Kata Beach,Madras Cafe,"If you are looking for Indian food, this is the place to visit ! South Indian as well as Punjabi food is great ! I loved the Sambhar !"
rn544547368,"Reviewed December 1, 2017 ", Kata Beach,Madras Cafe,"Location is perfect with good ambience and Indian taste.
I had Indian style fried rice and paper masala dosa..
Portion and taste was great ....will visit again..."
rn544437318,"Reviewed December 1, 2017 ", Kata Beach,Madras Cafe,"I would definitely recommend this place. The food looks ,smells and tastes delicious. Their unique variety of cuisines are a must try. I had paneer tikka masala, chicken korma,dal tadka,Seafood dosa and a few other dishes. The balance of flavours was just what you’ll need...More"
rn543836195,"Reviewed November 28, 2017 ", Kata Beach,Madras Cafe,Satisfied with the taste.. Onion uttapam was lovely & aloo paratha was just like home taste. Nice place to visit for indian food.
rn543807777,"Reviewed November 28, 2017 ", Kata Beach,Madras Cafe,We went to Madras cafe twice on our recent trip. First time our experience was below average but we decided to try one more time before sharing our experience. I found the staff very rude on both the visits. I am used to how the...More
rn543100587,"Reviewed November 24, 2017 ", Kata Beach,Madras Cafe,I m a south indian who came with little to no expectations whatsoever about finding good Indian food in Patong. Madras Cafe changed all that. Their idli and dosa is outstanding and the sambar deserves a special mention. Slightly pricier but worth it if you...More
rn580511170,Reviewed 5 days ago , Karon Beach,On The Rocks - Marina Phuket Resort,"A “little” tricky to find but a great restaurant next to the ocean, great sunset dining around 6pm in the month of May. We ate here twice during our visit staying at the Le Meridien in north Karon Beach.
The restaurant has a great feel...More"
rn578765974,Reviewed 1 week ago , Karon Beach,On The Rocks - Marina Phuket Resort,Your choice of the beauty of Thai cusine love the curries and for the not so brave their is plenty to choose from
rn578117623,Reviewed 2 weeks ago , Karon Beach,On The Rocks - Marina Phuket Resort,We once had dinner at On the Rocks during our stay at the Marina Phuket Resort. It´s enviably located just above the shore in traditional Thai decor. Make sure you book in advance if you want a table with immediate view to the sea. Staff...More
rn576995076,Reviewed 2 weeks ago , Karon Beach,On The Rocks - Marina Phuket Resort,"On the Rocks is a lovely and romantic dinner spot. My husband and I loved our time here. The rock lobster is a must! Service was a little slow, but that just gave us more time to enjoy the view!"
rn575197276,Reviewed 3 weeks ago , Karon Beach,On The Rocks - Marina Phuket Resort,"The place is pretty cool. Built into the rock side of the beach with an awesome view over the whole bay. You want to make sure that you reserve a table, as you otherwise will find yourself not dinning in the restaurant.
Food menu has...More"
rn574481693,Reviewed 4 weeks ago , Karon Beach,On The Rocks - Marina Phuket Resort,Well worth booking in advance to get a table with an uninterrupted sea view. The food and service was fantastic. We had the added pleasure of watching a storm move in as we ate. You just can’t pay for that sort of atmosphere!
rn573362413,"Reviewed April 14, 2018 ", Karon Beach,On The Rocks - Marina Phuket Resort,"Not bad but overall I would not recommend this place - you can have better
Location 8/10 : just above Karen beach. Really nice although a bit spoiled by the the internal decoration that made it look like a Disneyland restaurant
Food / menu 6/10:...More"
rn572444607,"Reviewed April 10, 2018 ", Karon Beach,On The Rocks - Marina Phuket Resort,"Popped in after a swim in the sea on the off chance they served food and we were delighted with the beautiful beach side restaurant that we found.
I wish the dressing on the mango salad could be bottled and sold in the UK!
We’re...More"
rn572346167,"Reviewed April 9, 2018 ", Karon Beach,On The Rocks - Marina Phuket Resort,"My friend lives in Phuket and I stay here half the year. Decided to try out this place for lunch and were disappointed and alarmed with their seafood dishes. The ginger chicken and the soup were okay. However, the fish with lemongrass was very smelly...More"
rn571865625,"Reviewed April 8, 2018 ", Karon Beach,On The Rocks - Marina Phuket Resort,"We're here in Phuket on a combination family vacation and getaway with friends. We all live in Hong Kong. For my husband's birthday, we took him out to a special meal at On The Rocks, knowing the sunset view would be beautiful and the food...More"
rn569581018,"Reviewed March 29, 2018 ", Karon Beach,On The Rocks - Marina Phuket Resort,I went their with big group of family members. Service was good. This restaurant is superb. Not too expensive but certainly you feel special.Everything was great. Especially Thai curries. You can order non spicy curry too if you are not sure about your stomach conditions....More
rn568502871,"Reviewed March 24, 2018 ", Karon Beach,On The Rocks - Marina Phuket Resort,My husband booked this for my 50th birthday meal he gave them confection for the table and asked them to make it special arrived there table was just normal staff not particularly friendly my husband ordered mussels. I went for chicken Kiev which was like...More
rn568197489,"Reviewed March 22, 2018 ", Karon Beach,On The Rocks - Marina Phuket Resort,"Almost a month ago, I visited with my family. Staffs are kind and foods are nice.
Especially they provided a birthday ceremony for my mother cause I just mentioned when I made a reservation for getting nice view place.
It was a great pleasure and...More"
rn566591115,"Reviewed March 14, 2018 ", Karon Beach,On The Rocks - Marina Phuket Resort,"Booked three days in advance and got a lovely table right on the seafront, stunning views of Karon beach. I had the salmon pasta which was delicious. On the expensive side for Thailand but still incredible value for money (in comparison to English prices)"
rn564862091,"Reviewed March 6, 2018 ", Karon Beach,On The Rocks - Marina Phuket Resort,"We’re staying at Beyond Karon, which is right next to this restaurant on the beach. We decided to try on the rocks since it looked like a nice place to eat with a view. Overall, the atmosphere was very nice, but the service was quite...More"
rn564712946,"Reviewed March 5, 2018 ", Karon Beach,On The Rocks - Marina Phuket Resort,"What a restaurant !
Dining ""On The Rock"" is an amazing experience since the table where you are going to seat will be only a few meters far from the sea (do not worry: if not immediately available, staff will move you as soon as...More"
rn564637459,"Reviewed March 5, 2018 ", Karon Beach,On The Rocks - Marina Phuket Resort,"We ordered enough to feed a table of four between us but the food was served so quickly. Every dish was beautiful. The staff could nt do enough, even taking photos. The location is amazing and very good value for money for what you get...More"
rn562038764,"Reviewed February 21, 2018 ", Karon Beach,On The Rocks - Marina Phuket Resort,"Beautiful location. Staff ignored us when we wanted to pay, not good service. The food was not as expected. Chicken was dry, rice tasteless, small portions. A bit more expensive than the other restaurants. Overrated, but very nice view."
rn561429232,"Reviewed February 19, 2018 ", Karon Beach,On The Rocks - Marina Phuket Resort,Walk through a tree lined walkway to get to this superb restaurant. The selection of Thai and Seafood was superb and everything was so fresh and well cooked. They even showed us pictures of their specials on an iPad and they tasted even better than...More
rn561343941,"Reviewed February 18, 2018 ", Karon Beach,On The Rocks - Marina Phuket Resort,"We had a great time here. The atmosphere was lovely and the view was fantastic. But a few hours later and into the next day, I was sick, probably from the chicken though I am not sure which food time it would be. But it...More"
rn560765036,"Reviewed February 15, 2018 ", Karon Beach,On The Rocks - Marina Phuket Resort,"Probably the best restaurant in Karon Beach. The location is amazing. Excavation on the sea. Just the way to reach it is a kind of discovery excursion inside a forest on a nice wooden footbridge. Then the food is aligned to the context, very good...More"
rn559837840,"Reviewed February 11, 2018 ", Karon Beach,On The Rocks - Marina Phuket Resort,"We had the most beautiful dinner at On The Rocks.
We enjoyed the seafood platter as well as Singapore noodles. The view, Service and entire experience was amazing. So happy we made the reservation to enjoy dinner with a beautiful view. We also got some...More"
rn559281985,"Reviewed February 8, 2018 ", Karon Beach,On The Rocks - Marina Phuket Resort,Maybe we were just not lucky but after having dinner here we were very sick. One - who ate a massaman curry chicken spent the night in pain and the morning vomiting. The other - who specified she had an allergy to soy was clearly...More
rn559026768,"Reviewed February 7, 2018 ", Karon Beach,On The Rocks - Marina Phuket Resort,"We came here for 4 times - absolutely in loved with this place for the atmosphere, tasty dishes and service. Absolutely recommend!
The prices are medium, our check was approximately 2000 bath for 2 persons. We usually took 2 soups (180 bath each), main course...More"
rn558638338,"Reviewed February 5, 2018 ", Karon Beach,On The Rocks - Marina Phuket Resort,This restaurant is perfect for a special dinner. The view looks along the whole length of the beach. Staff are extremely efficient and lovely.
rn558030128,"Reviewed February 2, 2018 ", Karon Beach,On The Rocks - Marina Phuket Resort,Came here after reading great TA reviews. As you walk in the view is incredible however the food however leaves a lot to be desired. Recommended the steamed snapper as it was apparently freshly caught today and garlic pepper rock lobster. Fish came out and...More
rn557646800,"Reviewed January 31, 2018 ", Karon Beach,On The Rocks - Marina Phuket Resort,Me and my fiancé went here for dinner. We ate delicious Thai food while watching the sun set by the ocean horizon while we sat just above the beach. The food and service was great. The only thing that annoyed me was that we did...More
rn556488801,"Reviewed January 26, 2018 ", Karon Beach,On The Rocks - Marina Phuket Resort,"Had a very good seafood dinner with my wife. We came walking from Karon Beach, the restaurant has a fantastic beach view and the atmosphere is really fantastic. This was great value for our money and we are going back later this week."
rn556439999,"Reviewed January 26, 2018 ", Karon Beach,On The Rocks - Marina Phuket Resort,Don’t go for lunch or dinner. The food is horrible. The service is poor. It has very beautiful scenery and decor so it’s place to sit and enjoy the scenery and have a beer.
rn555112167,"Reviewed January 21, 2018 ", Karon Beach,On The Rocks - Marina Phuket Resort,"We were able to get a table even though we hadn't made reservations. We ordered the grilled duck and the roasted duck with mango sauce; both tasted excellent. Despite not sitting at the edge, we had a fantastic view of Karon beach from our seating....More"
rn553878091,"Reviewed January 14, 2018 ", Karon Beach,On The Rocks - Marina Phuket Resort,"We travelled to Karon Beach from Sydney Australia, to celebrate our 30th Wedding Anniversary.
Before we left we looked up best Restaurant to eat at on the actual night of our Anniversary as we wanted to make the night very special.
On arrival at our...More"
rn553473644,"Reviewed January 12, 2018 ", Karon Beach,On The Rocks - Marina Phuket Resort,"Very nice view, you should go there before sunset. Portion of the plate is very little.not worth the price. Food taste was average."
rn552465693,"Reviewed January 8, 2018 ", Karon Beach,On The Rocks - Marina Phuket Resort,Our dinner was excellent. We had a great time and the food was brilliant. The menu is varied and should cater for most needs.
rn552351403,"Reviewed January 7, 2018 ", Karon Beach,On The Rocks - Marina Phuket Resort,Pre booked a table as reviews looked good. Its a small restaurant with fantastic views. Service was excellent and food and wine quality was too. Would definitely recommend though necessary to pre book.
rn552138074,"Reviewed January 6, 2018 ", Karon Beach,On The Rocks - Marina Phuket Resort,"Food was 2 out of 5. Poor thai food - very oily.
Good view. Otherwise i wont return.
Soups were ok.
Service extremely slow and restaurant was half empty."
rn551980480,"Reviewed January 6, 2018 ", Karon Beach,On The Rocks - Marina Phuket Resort,"We dined here 3 times and thoroughly enjoyed each time. The food is of very good quality, looks great and tastes delicious. The approach via a timber staircase off the beach is a delight and the view from its perch on the cliffs amongst the...More"
rn551182657,"Reviewed January 3, 2018 ", Karon Beach,On The Rocks - Marina Phuket Resort,Amazing restaurant beautifully situated om the edge of the Karon beach! Ordered the lobster with mushroom and cheeze sauce which was absolutely delicious. Very pleasant staff. Highly recommend a visit. Make sure to book a table!
rn549974720,"Reviewed December 29, 2017 ", Karon Beach,On The Rocks - Marina Phuket Resort,We went for the view but were really surprised by how great the food was! We had the coconut chicken soup (to die for!) and a chicken cashew stir fry. I didn't think a stir fry could be SO good! Price was more than the...More
rn549130523,"Reviewed December 25, 2017 ", Karon Beach,On The Rocks - Marina Phuket Resort,"If you want to have a special and very nice dinner - go to ”On the Rock” in Kata, Phuket (try to have a sea view table and you will see Karon beach who lies below). The service is very good and also the food....More"
rn545800412,"Reviewed December 7, 2017 ", Karon Beach,On The Rocks - Marina Phuket Resort,"Beautiful location at the quiet end of the beach and, as the name suggests, perched up on the promontory from where you can watch the sea crashing around the rocks below and Chinese lanterns floating by in the night sky.
The wife and I thought...More"
rn544677510,"Reviewed December 2, 2017 ", Karon Beach,On The Rocks - Marina Phuket Resort,While teh service and location were good. The food was not of a high quality. Most of our dishes were only warm. they were not served hot.. Overall we were disappointed considering the cost.
rn544243702,"Reviewed November 30, 2017 ", Karon Beach,On The Rocks - Marina Phuket Resort,"Saw this place from the beach, went and booked straight away for that evening, staff lovely and friendly, meals were delicious <f0><U+009F><U+0098><U+008B> and sticky rice with mango is lush, decided to book again for last night here with sea view table so really looking forward...More"
