Hotel_ID,Review Date,Location,Hotel/Restaurant name,Review
rn332214925,"Reviewed December 11, 2015 ", Kata Beach,Red Snapper,"Best Japanese and Italian food that I have ever tasted in Kata Phuket with my family.Good service for the very fresh and delicious food..sushi, pasta....Especially reasonable price. Certainly we come back again for our excellent meal every time we visit Phuket."
rn331697797,"Reviewed December 9, 2015 ", Kata Beach,Red Snapper,"The menu said Japanese/Italian...A strange combination....The meal was barely edible...I had Lasagne, it was a child size portion and very average, my wife had chicken teriyaki, it was mostly fat and very little teriyaki sauce, and my son had Chicken Curry, once again, full of...More"
rn331366649,"Reviewed December 8, 2015 ", Kata Beach,Red Snapper,Stopped by here for lunch as we felt like having some sashimi and some ramen. I was intrigued by the japanese-italian connection which is a first for me. The place was just getting ready to open after being closed for a few days. It does...More
rn327930605,"Reviewed November 19, 2015 ", Kata Beach,Red Snapper,Good food with a diverse menu but you better have plenty of time to wait. Meal comes before apetizer. 3 people all served about 15 minutes or more apart.
rn321592669,"Reviewed October 25, 2015 ", Kata Beach,Red Snapper,As others have said we were a bit dubious about a Japanese/Italian combo but the food was incredible. We all chose exclusively Japanese dishes so can't comment on the Italian side of it but the food we had was amazing. Everything was beautifully presented and...More
rn321298266,"Reviewed October 24, 2015 ", Kata Beach,Red Snapper,This may seem a strange combination Japanese/Italian but it is a 'must do' while in Kata. We had a fabulous evening with great cocktails and the food was simply delicious . Great service also . Highly recommend !
rn320593193,"Reviewed October 21, 2015 ", Kata Beach,Red Snapper,"Everytime I visit Kata, I go to this restaurant 3 or 4 times. One of my favourites. Friendly staff, lovely Italian and Japanes food. Can get busy, but you can sit in the bar next door, order food and they bring it to you.More"
rn318902802,"Reviewed October 15, 2015 ", Kata Beach,Red Snapper,"Upon first seeing the Red Snapper, I was completely dismissive because of the sign, ""Italian and Japanese"" restaurant. How can a Japanese also be an Italian???
Well thankfully my love for Japanese food got the better of me and I decided to give it a...More"
rn316728995,"Reviewed October 6, 2015 ", Kata Beach,Red Snapper,Reviews rated this place highly and we were not disappointed. We had a late lunch as they open later in the arvo. We were the only customers so service was quick and food was delicious. Their home made lemon ice tea is a must try!...More
rn315936657,"Reviewed October 3, 2015 ", Kata Beach,Red Snapper,"Really great Japanese selection of food! The sushi very tasty, springs rolls had a really nice sauce which was a great change to the norm, and I would definitely recommend the soba noodle mains! Very friendly and helpful staff too :)"
rn314002760,"Reviewed September 27, 2015 ", Kata Beach,Red Snapper,"Superb quality food and reasonable prices, one of our best meals in Thailand, we will definitely be back to Red Snapper before we leave"
rn307108750,"Reviewed September 4, 2015 ", Kata Beach,Red Snapper,Enjoyed the sushi here very much. Had a delicious gnocchi for desert. Ate here twice with wife and a friend while visiting Kata. Very friendly staff. Would go back for sure.
rn298078962,"Reviewed August 11, 2015 ", Kata Beach,Red Snapper,"Always go here when in Phuket however last nights dinner of sushi, ginger and soy pork with rice and crispy chicken was fantastic! Also sampled the passion
Fruit margaritas which were great. Reasonably priced and lovely staff"
rn294949703,"Reviewed August 2, 2015 ", Kata Beach,Red Snapper,Great sushi and italian japanese fusion food. Enjoyed it and came back 2 times. Atmosphere is casual and surfy
rn289902462,"Reviewed July 17, 2015 ", Kata Beach,Red Snapper,"We visited as we wanted something a little different. The menu is a strange mix of cuisine but we all found something to suit us. The staff are lovely, the drinks were served immediately and the food took a bit longer but it was all...More"
rn288320558,"Reviewed July 12, 2015 ", Kata Beach,Red Snapper,Had lunch with the family. The staff and the quality of the food was good 7 out of 10. However we were the only customers and during our lunch we ordered one extra plate of spaghetti carbonara and had to wait around 25 min... Seemed...More
rn288063931,"Reviewed July 11, 2015 ", Kata Beach,Red Snapper,"Just before the Kata Beach night market stalls you fine The Red Snapper Restaurant, worth a look if your not too hungary. I enjoyed the home made gnocci but it was very small. The sabi fish and vege was lukewarm fish with 2 small potato...More"
rn285709702,"Reviewed July 5, 2015 ", Kata Beach,Red Snapper,"Lovely place to sit in, but food average and didn't live up to the expectation I had. Nice if you want a change of pace from Thai food"
rn285433598,"Reviewed July 3, 2015 ", Kata Beach,Red Snapper,"Nice fresh Japanese flavours from the Japanese chef. We were looking for thai food & a bit disappapointed when we realised this was only japanese (we hit the hunger wall after wandering for some time).
But were really happy we stumbled on this place when...More"
rn282845994,"Reviewed June 25, 2015 ", Kata Beach,Red Snapper,"Delicious sushi, good size portions, great value, great service from a smilie group of people who clearly get on really well. Benito fish of the day was a particular highlight as well as the salmon and cream cheese roll.
(I haven't been to Japan but...More"
rn281578381,"Reviewed June 20, 2015 ", Kata Beach,Red Snapper,"The best sushi restaurant in Thailand and on Koh Samui!! It was my friends birthday and she got an amazing cake!! Thank you lovely staff!
- From Denmark"
rn280781433,"Reviewed June 16, 2015 ", Kata Beach,Red Snapper,"The sushi were fresh, the fish was delicious, but the choice is limited and sushi were falling apart on the plate."
rn280055797,"Reviewed June 14, 2015 ", Kata Beach,Red Snapper,"Love Red Snapper! It was super close to our hotel, so we went 3x! Our waitress (cannot remember her name...), was fantastic! She remembered us after our first visit and was so excited to see us return and she remembered our orders!"
rn278737101,"Reviewed June 8, 2015 ", Kata Beach,Red Snapper,The food is divine! The drinks are also interesting. The salads are to-die-for - orgasmic! The environment is great - wonderful shopping nearby.
rn278627849,"Reviewed June 7, 2015 ", Kata Beach,Red Snapper,"I liked the atmosphere more than the food but overall worth a visit. The staff are excellent, very helpful and pleasant."
rn274973819,"Reviewed May 27, 2015 ", Kata Beach,Red Snapper,the food i had was ok but not overly special for the price they were asking. good experience but I will probably not go back.
rn272268220,"Reviewed May 15, 2015 ", Kata Beach,Red Snapper,"we stayed in the sugar marina surf hotel next door and thought we would try out this place,what a smart move,the food was amazing,japanese chef served beautiful sashimi and sushi,over 2 weeks we tried nearly everything on the menu between 3 of us an it...More"
rn271537693,"Reviewed May 12, 2015 ", Kata Beach,Red Snapper,"We were in an apartment not far from this fantastic eatery. Currently it is the low season in Phuket so we had no problems getting a table out of prime time (7pm-10pm). We ordered a mix of Japanese and Italian food.
The food quality was...More"
rn579790348,Reviewed 1 week ago , Kata Beach,Pim's Place,"We stopped here because we were on a search for some pizza. Off of the main road through Kamala it is very easy to find and has plenty of seating for everyone. The menu has about 25 different types of pizza, plus the option to...More"
rn574475292,Reviewed 4 weeks ago , Kata Beach,Pim's Place,I had read some reviews about Pim’s having the biggest pizza so since we were so hungry we decided to order with delivery to hotel. Pizza was big but paper thin. I will not recommend it.
rn573010685,"Reviewed April 13, 2018 ", Kata Beach,Pim's Place,"Just ate here, terrible food, terrible service. I understand hospo isn’t the most thrilling work but the service here made me feel like I was doing something bad just by eating there, waitress was stand-offish and rude. Had pad Thai, made vegan, and was just...More"
rn572991530,"Reviewed April 12, 2018 ", Kata Beach,Pim's Place,Got into Phuket later into the day and I was looking for something fast and easy. We found this spot on TA and knew I had to try their pizza. We ordered take out to our resort and they delivered it to us without any...More
rn570478680,"Reviewed April 2, 2018 ", Kata Beach,Pim's Place,Definitely recommend! Great large thin crust pizzas and prompt delivery! Stayed at Keemala and they had no problem taking our order and delivering to our hotel room.
rn567848410,"Reviewed March 21, 2018 ", Kata Beach,Pim's Place,"We ordered the Pimms Pizza it was amazing, they said half an hour for delivery and it was right on time delivered to our hotel. It was a huge pizza so but thin crusted. Highly recommend."
rn564571333,"Reviewed March 5, 2018 ", Kata Beach,Pim's Place,We tried the Thai food and Pizza. It was excellent. Just try it. Biggest pizza in Phuket. For sure. Thai food also good.
rn559750499,"Reviewed February 11, 2018 ", Kata Beach,Pim's Place,"Walked in on a Wednesday evening about 7.30pm. Was led to a table in a far corner and given a menu within 2 minutes. A Couple next to us asked for the bill.
Waitress acknowledged them and scurried away.
We then waited to be asked...More"
rn556982969,"Reviewed January 28, 2018 ", Kata Beach,Pim's Place,"The opening hours are great... til 2 am. Even they delivery so late. I ate meat pizza... the pizza comes as skandinavy style... thin and crispy. The size is huge and u never will leave hungry. The staff friendly and fast service.
Yes... will be...More"
rn556710340,"Reviewed January 27, 2018 ", Kata Beach,Pim's Place,"Me and hubby went for dinner at Pims. It was the first time for us. Service was quick. We had ordered fried prawn , Penang curry and whole fish with sweet chilli sauce. All very tasty and will definitely come again or maybe do delivery...More"
rn554953365,"Reviewed January 20, 2018 ", Kata Beach,Pim's Place,the food is good but you can get cheaper and more quality and quantity in other thai places around Kamala
rn554566536,"Reviewed January 18, 2018 ", Kata Beach,Pim's Place,"Pim's Place is great. The Pizzas are the best in town (and huge).
The portions in general is very large, you wont have to leave hungry!"
rn552123133,"Reviewed January 6, 2018 ", Kata Beach,Pim's Place,"Long waiting time (1,5h) Food not good! Only one person I the kitten;( I can recommend Tuk tuk food!"
rn551068859,"Reviewed January 2, 2018 ", Kata Beach,Pim's Place,"This restaurant is on the main road in Kamala.
We were given a warm welcome & were seated for our dinner
There’s a good selection on the menu, we had green curry, kebab plate with fries, tuna salad & a meat lovers pizza.
The food...More"
rn549306648,"Reviewed December 26, 2017 ", Kata Beach,Pim's Place,Very Big and nice pizzas! Can highly recommend. Even thou I can not eat gluten this pizza works for me. <U+2600><U+FE0F><U+2600><U+FE0F><U+2600><U+FE0F><U+2600><U+FE0F><U+2600><U+FE0F>
rn549085964,"Reviewed December 24, 2017 ", Kata Beach,Pim's Place,We are extremely dissapointed by your review on this shop. We demand a refund from you. I was hungry and thirsty and i had to eat. Do not mislead innocent people like us. Honestly you rated this restaurant 5 star???
rn548513444,"Reviewed December 21, 2017 ", Kata Beach,Pim's Place,Trip advisor recommendations everywhere but service did not match even basic expectations. Pizza's excellent once they arrive 20 mins after first main course dish arrived and 10 mins after 2nd then 3rd. everything was dished up piecemeal. The other dishes quality wise were excellent or...More
rn545741428,"Reviewed December 7, 2017 ", Kata Beach,Pim's Place,"Very good and big pizza for around 300 B.
It could get some more topping, since the borders are very big but definitely very good."
rn545240479,"Reviewed December 5, 2017 ", Kata Beach,Pim's Place,Thank you Thomas for hosting the International Surf lifesavers for dinner. we loved experiencing Thailand and the hospitality and service (and Pizza) at Pims was a blast. Connect 4 was a crowd pleaser!
rn545156424,"Reviewed December 4, 2017 ", Kata Beach,Pim's Place,"The restaurant is situated 5 mins away from the villa we are staying. We went there for lunch and we were the only customers at that time. Service was really slow and we waited long for the food. The pad thai, club sandwich, green curry...More"
rn543928154,"Reviewed November 28, 2017 ", Kata Beach,Pim's Place,First time I was eating in Pim's restaurant we were 2 people ordering a big pizza each.. The owner approached us and recommended we should move to a bigger table since we both ordered a big pizza. And indeed we needed a bigger table. WE...More
rn543891188,"Reviewed November 28, 2017 ", Kata Beach,Pim's Place,"I really liked Pim's Place. The owner was so nice, and made sure my group was well fed and happy. The menu is very extensive. Some got pizza--which is huge and has a very think crust (which is my favorite). I got a traditional Thai...More"
rn542112297,"Reviewed November 19, 2017 ", Kata Beach,Pim's Place,Service was lazy and slow. We have to wait for menus and our foods even longer. Ceasars salad was okay and it had even becon in it. Spring rolls were too dry and outer layer of rolls were too thick.
rn534522638,"Reviewed October 20, 2017 ", Kata Beach,Pim's Place,Had a tasty Noodle soup! had a Pizza and it was soon good!! I even got a Cosmo... awesome and very cheap!!!
rn529371947,"Reviewed October 3, 2017 ", Kata Beach,Pim's Place,"Nice place on a busy street (shops, other restaurants, markets, etc). Good atmosphere and friendly staff. Food isn't expensive and tasted good. I must add I only tried Asian food here, not Western."
rn526910845,"Reviewed September 24, 2017 ", Kata Beach,Pim's Place,"The dinner party looks great along the way with beautiful pictures of the food! But when it comes in, it looks like something else. The burger was dry and overcooked, the bread was old. The pizza was huge but totally tasteless.The Thai food can not...More"
rn526735297,"Reviewed September 23, 2017 ", Kata Beach,Pim's Place,"We were looking for a pizza in Kamala and found this one as top rated on TripAdvisor.
We were extremely disappointed. While the pizza is huge, the pastry is nowhere near an authentic pizza.
There are far better options a bit further in Phuket."
rn524502352,"Reviewed September 14, 2017 ", Kata Beach,Pim's Place,"I was having thai food for many days, so i was craving for a carbonara. I probably should not expect much, the portion is good, but the pasta is soaked in too much sauce almost like a soup. The taste is not bad. The thai...More"
rn524329376,"Reviewed September 14, 2017 ", Kata Beach,Pim's Place,"Delicious fare, friendly staff and prices that are very reasonable.
We've enjoyed ourselves there a couple of times."
rn523894261,"Reviewed September 12, 2017 ", Kata Beach,Pim's Place,"Here are a few comments about the large meat pizza delivered to my home.
While I've had many good meals at Pim's, this was my first pizza. And, finally, when they say large, it really is large! The crust was very thin. A very tasty...More"
rn523308087,"Reviewed September 10, 2017 ", Kata Beach,Pim's Place,"We've been here having breakfast for our stay in kamala since day one... was looking for a good restaurant and found the ""free hugs"" sign in front of the door wich i loved and decidet to give it a chance... :) what can I say,...More"
rn508908017,"Reviewed August 4, 2017 ", Kata Beach,Pim's Place,"Since arriving in Kamala, I have purchased a number of snacks at this outlet at the entry to Big C. I only noticed today that it is a outlet of Pim's main restaurant further along the street. 450mm of pork ribs for THB170; cheap, delicious,...More"
rn500573315,"Reviewed July 10, 2017 ", Kata Beach,Pim's Place,Very good pizza and a variety of European and Thai food. Reasonably priced and everything on the menu is good.
rn500275494,"Reviewed July 10, 2017 ", Kata Beach,Pim's Place,"We ordered a take out at Pim's.A large pizza,a chicken kebab and papaya salad.The portions are HUGE...good for large families or groups. Food is tasty and delivery was reasonable."
rn497560920,"Reviewed June 30, 2017 ", Kata Beach,Pim's Place,"Great food, big pizzas and wife says that they have best green curry at this point of our trip <f0><U+009F><U+0098><U+0081>. Great and friendly staff !!!"
rn490831793,"Reviewed June 5, 2017 ", Kata Beach,Pim's Place,<U+0E1E><U+0E34><U+0E0B><U+0E0B><U+0E48><U+0E32><U+0E16><U+0E32><U+0E14><U+0E43><U+0E2B><U+0E0D><U+0E48><U+0E21><U+0E32><U+0E01> <U+0E2D><U+0E23><U+0E48><U+0E2D><U+0E22> <U+0E1B><U+0E23><U+0E30><U+0E17><U+0E31><U+0E1A><U+0E43><U+0E08><U+0E01><U+0E31><U+0E1A><U+0E01><U+0E32><U+0E23><U+0E1A><U+0E23><U+0E34><U+0E01><U+0E32><U+0E23><U+0E02><U+0E2D><U+0E07><U+0E17><U+0E38><U+0E01><U+0E04><U+0E19><U+0E17><U+0E35><U+0E48><U+0E19><U+0E31><U+0E48><U+0E19> We ate big and delicious pizza. Everyone was impressed with this place.
rn490323196,"Reviewed June 4, 2017 ", Kata Beach,Pim's Place,"Little to say, Thomas and Pim, the owners, are very friendly, the food is really good with reasonable prices and, if you are lucky enough, you can get the chance of one of their famous ""free hugs""!
Thumbs up!"
rn489025219,"Reviewed May 30, 2017 ", Kata Beach,Pim's Place,"Kung Kra phera with no capow
Orders meal of prawns with basil came out bland not a chilli in sight.
This dish meant to be cooked with lots of spice and loads of chillies sent back to be done properly came back recoiled prawns toughseafood...More"
rn486727244,"Reviewed May 22, 2017 ", Kata Beach,Pim's Place,The restaurant is on the main road. Not special place but good and clean. The different pizzas u can order are great. Is crispy like a flame and not same normal pizzas but the taste is great... better then most pizzas i ate. Will be...More
rn480136988,"Reviewed April 30, 2017 ", Kata Beach,Pim's Place,I can recommend this place located outside the Big C supermarket. Great for a morning ice coffee made to perfection.
rn479905405,"Reviewed April 29, 2017 ", Kata Beach,Pim's Place,"Great pizzas, the staff are very friendly and always able to help. Big pizzas so make sure you get one between 2 or 3 people!"
rn478513806,"Reviewed April 24, 2017 ", Kata Beach,Pim's Place,"We had dinner here and in short all good!
We had Thai food and I took massaman chicken curry:
- Just excellent!
As starter we took a mixed of spring rolls and garlic bread. As we were 4, they accommodate us so we have 1...More"
rn475211669,"Reviewed April 13, 2017 ", Kata Beach,Pim's Place,"Gillar du pizzor med tunn frasig botten är detta stället att besöka, du bör vara hungrig för deras pizzor är enorma...... men goda! De har även utkörning.
Like pizzas with thin crispy base, this is the place to visit, you should be hungry for their...More"
rn472002422,"Reviewed April 1, 2017 ", Kata Beach,Pim's Place,"We were sat watching football in the black cat bar & fancied a snack. We ordered Nachos & cheesey garlic bread. The food arrived & had clearly been delivered.
It came from Pims place.
The Nachos portion was fantastic and enough for 2, the garlic...More"
rn469817455,"Reviewed March 24, 2017 ", Kata Beach,Pim's Place,"If you check my profile you'll see I don't often review restaurants because eating out is such a subjective experience. However, we tried this place based on numerous reviews raving about the pizza. If that's why you're headed here - don't. We ordered a pepperoni...More"
rn467966232,"Reviewed March 16, 2017 ", Kata Beach,Pim's Place,service was average and all drinks wasn't bad at all they served ready made pizza firstly they ordered from another pizza place after they gave us to eat that was survival lunch
rn466087635,"Reviewed March 10, 2017 ", Kata Beach,Pim's Place,"Nice staff, and nice food. In every table there was a game which you can play while waiting. Next to a busy and noisy Patong road."
rn460546802,"Reviewed February 16, 2017 ", Kata Beach,Pim's Place,"We found Pims place on the main street on our first nights stay in Kamala. It's a little gem, the staff are lovely and happy to help in any way they can and the food is absolutely delicious. I ordered a pizza and was surprised...More"
rn459551947,"Reviewed February 13, 2017 ", Kata Beach,Pim's Place,"It was a late Tuesday night when my friend Dirty Disco Daryl suggested we get a pizza in Kamala. I'm from New York City, the land of the great pizza so I'm kind of picky about my pie. I was shocked to find Pim's open...More"
rn458269576,"Reviewed February 9, 2017 ", Kata Beach,Pim's Place,"Delivered promptly. Reasonable pizza , but lasagna was good ..reccomended..they delivered on time without a hassle.."
rn457479194,"Reviewed February 5, 2017 ", Kata Beach,Pim's Place,Pims serves decent sized pizza's but when its really humid and warm there is no AC so as long as you don't mind to perspire....sweat its great. They now have a small take away inside the Big C market where they have a selection of...More
rn456373562,"Reviewed February 1, 2017 ", Kata Beach,Pim's Place,"Ordered two pizzas takeaway and despite not having them straight out of the oven we were blown away. The pizza's were perfectly crispy, toppings and cheese succulent and huge in size. I've had pizza on the Amalfi coast, Florence, New York and Chicago and I...More"
rn450329099,"Reviewed January 7, 2017 ", Kata Beach,Pim's Place,I have ordered Thai food and It was the worst Thai food in Thailand...In addition the strawberry shake was consist almost with only sugar. Not recommended.
rn450134108,"Reviewed January 7, 2017 ", Kata Beach,Pim's Place,"Always enjoy meals here. Thin crust pizza is exceptional. Everything on the menu is good, Thai and farang food. You really can't go wrong here with a fun atmosphere and nice people."
rn449583220,"Reviewed January 5, 2017 ", Kata Beach,Pim's Place,"Having sampled pizza the world over I have encountered things I rather would have not under the guise of ""pizza"" on a menu. This was one of the weirdest even though it tasted quite good. The pizza is almost paper thin but it is a...More"
rn447704780,"Reviewed December 30, 2016 ", Kata Beach,Pim's Place,"The restaurant is located on the main road in Kamala, so it can be a bit noisy on the terrace.
They have a large menu. We both picked a pizza : the margarita and vegetarian ones.
The margarita was very good. The vegetarian was a...More"
rn446008304,"Reviewed December 21, 2016 ", Kata Beach,Pim's Place,"After two weeks in Thailand I was really looking for something different! We ordered one pims pizza for two. The pizza was ok, I won't say is the best pizza I have ever eat but I was also not disappointed. It was very thin and...More"
rn444791620,"Reviewed December 17, 2016 ", Kata Beach,Pim's Place,"We visited pim's place for what is promoted as the best.pizza in kamala according to reviews
We found the.pizza very disapointing very thin and dried out not much topping and very bland
Staff not efficient we had finished a drink and they did not ask...More"
rn443669139,"Reviewed December 11, 2016 ", Kata Beach,Pim's Place,"We went by in search for a reasonably priced lunch meal and just decided to go for it, from outside it doesn't look too promising but we were hungry and just tired of searching. We ordered a pizza and shrimps to share.
When the pizza...More"
rn441334741,"Reviewed December 1, 2016 ", Kata Beach,Pim's Place,Just went to the Pim´s to order a pizza for take away. I had decided in my mind I´ll have a Bloody Mary while waiting for the pizza to take. Bloody Mary was on the drink list among so many international cocktails. Asked for one....More
rn440992278,"Reviewed November 29, 2016 ", Kata Beach,Pim's Place,Ok these guys are fair dinkum!! They make good Italian food and the pizzas are good too. We had tired kids who didn't want to go out so we opted for home delivery. Our villa was high up the hill but we got the food...More
rn439189798,"Reviewed November 21, 2016 ", Kata Beach,Pim's Place,"First of all, my apologies for not doing this review earlier.
I have been to Pims several times over the past few months, and it’s always been a wonderful experience. They have a delightful staff, and the portions are large and delicious.
The papaya salad...More"
rn429132672,"Reviewed October 18, 2016 ", Kata Beach,Pim's Place,If I could rate more than 5 stars for the fresh stone baked pizzas I would! Absolutely amazing!! Would definitely recommend
rn425222600,"Reviewed October 5, 2016 ", Kata Beach,Pim's Place,Awesome thai food and cocktails cool 80s music and played darts while sippibg cocktails. Had really tasty steamed snapper so cheap and great value
rn416071788,"Reviewed September 8, 2016 ", Kata Beach,Pim's Place,"Had a great meal here, their massaman curries are delicious and the kids loved the pizza. (and playing connect 4 at the table whilst waiting for the food). The owner/manager was really friendly, and the lemon juice/smoothie was great. We also got takeaway one night...More"
