Hotel_ID,Review Date,Location,Hotel/Restaurant name,Review
rn435672207,"Reviewed November 8, 2016 ", Kata Beach,Red Corner,Had my first Thai meal here and was not disappointed. I had a simple Thai red curry and it was delicious.
rn429989200,"Reviewed October 20, 2016 ", Kata Beach,Red Corner,We read other reviews about local places. This one seemed to fit what we were looking for. We were able to order four dishes which were all very tasty. Our seafood salad came first; woah was it spicy! To be fair they asked if we...More
rn422798114,"Reviewed September 27, 2016 ", Kata Beach,Red Corner,Service was very friendly and quick. The food was good and a good price for people on a budget. The pineapple baked rice was very yummy and had a good amount of seafood in it. Nice restaurant would recommend b
rn409074391,"Reviewed August 22, 2016 ", Kata Beach,Red Corner,great choice for a great meal at the right price. large meals. great beer prices. service was very good
rn408570022,"Reviewed August 22, 2016 ", Kata Beach,Red Corner,"I don't no what another said but here is very good what I never find. It's have show lady man for somebody birthday.
Beer in ice glass <f0><U+009F><U+008D><U+00BA> <f0><U+009F><U+008D><U+00BA> so cool.
Love Seafood.
I enjoyed whit it's"
rn404495077,"Reviewed August 12, 2016 ", Kata Beach,Red Corner,"We are order BBQ Tigerpown,Pancake,Noodle soup and Blue margarlita. Here It's not long time to wait food is great and friendly staff.We are happy to eat here."
rn403591395,"Reviewed August 10, 2016 ", Kata Beach,Red Corner,"I come with My Family. We like to eat Tomyam duck Rost Papaya Salad.
They are good Service and good Food.Nice to ist Here. Chip Price. We well come back Ägäis."
rn400355933,"Reviewed August 2, 2016 ", Kata Beach,Red Corner,"we are had red corner restaurant frist night in kata beach nice dinner
Tom yum shrim is really nice soup some shrim bbq really taste stuff is very friendly waiter speak russain we are had two everytime dinner red corner restaurant we are come back...More"
rn398234429,"Reviewed July 27, 2016 ", Kata Beach,Red Corner,This place is terrible. It took close to an hour for our food to arrive. Meanwhile next door at the open air bar they are blasting Tupac sakur. The food was bland at best. And they served fresh water fish while charging prices normally reserved...More
rn396038998,"Reviewed July 23, 2016 ", Kata Beach,Red Corner,"We have been to Phuket previously but our first time in Kata. We had dinner at Red Corner Rest. Menu is extensive lots to choose from our choices were spring rolls, satay chicken, seafood Phad Thai, fried rice with crab meat. The Satay chicken &...More"
rn391016702,"Reviewed July 10, 2016 ", Kata Beach,Red Corner,"I went to tried .Sea food are very fresh
I come many frends abont 8 persen but when i pal bill is only 1050 jajaja we eat a lot food that day i well go again"
rn390330419,"Reviewed July 8, 2016 ", Kata Beach,Red Corner,Friendly staff and fresh and tasty food. Found it on accident while walking back from kata beach! Prices are reasonable and they make sure you like your food.
rn390329805,"Reviewed July 8, 2016 ", Kata Beach,Red Corner,"Yummy food, good service, free shake with review on trip advisor! They have Italian, Thai, fresh seafood everyday! Worth it."
rn389339442,"Reviewed July 5, 2016 ", Kata Beach,Red Corner,"This restaurant I come first time but is so very good. I like tomyam,coconut soup,yam seafood and here is have many fruit shakes whan i pay bills i have free watermelon. Love red corner."
rn388905978,"Reviewed July 3, 2016 ", Kata Beach,Red Corner,"Came across this place by accident, great fresh food and polite service. Plenty of fans to keep people cool. Highly recommended!"
rn388660512,"Reviewed July 3, 2016 ", Kata Beach,Red Corner,"Really good price, lots to choose from and very delicious! My friend who I ate with is a vegan and they catered for her with lots of choice, she enjoyed her meal also. Would definitely come again :)"
rn386012014,"Reviewed June 26, 2016 ", Kata Beach,Red Corner,"Very nice service. Good food. Mid range prices, but cheaper than other things in the area. It's a good choice if in the neighbourhood."
rn381106446,"Reviewed June 9, 2016 ", Kata Beach,Red Corner,It's our last night in phuket and we were desperately looking for authentic thai food the staff are friendly and the service is quick ped thai is so good i like it's very mach i wall come back agine
rn380165056,"Reviewed June 6, 2016 ", Kata Beach,Red Corner,"This place is cheap food and good food we will come back here again
Thank you for this food all food. 560 Beth. Red corner I love this place"
rn377855453,"Reviewed May 30, 2016 ", Kata Beach,Red Corner,"Although there weren't many vegetarian items on the menu, the staff was kind enough to show us what they could ""veggi-fy."" We got green curry with extra veggies and a delicious papaya salad. Both were really great! $120 curry, $80 salad, $20 for steamed rice....More"
rn375020730,"Reviewed May 21, 2016 ", Kata Beach,Red Corner,Delicious food! Great deal for the portion sizes. They also have wifi and decent drink prices as well. Our server even brought us a free plate of watermelon at the end of our meal.
rn372051724,"Reviewed May 11, 2016 ", Kata Beach,Red Corner,"By far the best Thai I've found in kata.Thai is my second trip to kata, and still haven't found a Thai food restaurant better to eat at.the owner is is friendly,she make you feel like you a visitor in her own home."
rn372049666,"Reviewed May 11, 2016 ", Kata Beach,Red Corner,This place was adorable and really helpful about any questions on the menu. I got the Tom Yam soup with rice and the Fried Morning Glory in Oyster Sauce. It was all fantastic! I got the medium spicy Tom Yam (honestly I could've gone spicier...More
rn371354266,"Reviewed May 8, 2016 ", Kata Beach,Red Corner,"Red corner restaurant. Staff are very helpful. Lots of room. Lots of fans to keep cool. Near the beach, easy to find. Very happy to bring a chair and toys for my toddler. Very good."
rn370900653,"Reviewed May 7, 2016 ", Kata Beach,Red Corner,Excellent restaurant to try thai food. Large potion on each dishes. Prices are fair and the staffs are very friendly.
rn370669629,"Reviewed May 6, 2016 ", Kata Beach,Red Corner,"great food very friendly staff recommend you pay a visit if you in kata beach
seafood a specially also European very good"
rn368713995,"Reviewed April 29, 2016 ", Kata Beach,Red Corner,Came here with my girlfriend looking for a cheap Thai dinner and was not disappointed! We were able to pick exactly what fresh seafood we wanted and how it would be cooked. We asked for their recommendation and every dish that came out was amazing....More
rn367068218,"Reviewed April 24, 2016 ", Kata Beach,Red Corner,"This place is a amazing finding on Kata streets between all the cafe around. Here you will find delicious food and clean tables. We come here everyday and enjoy every lunch. Prices lower than in cafe nearby, small beer costs 70bth, best tom yam I...More"
rn366768745,"Reviewed April 23, 2016 ", Kata Beach,Red Corner,"This is the place that we went on regular basis during our vacation in Phuket. Prices are good,service is fine and the food is awesome. I would recommend this place to my friends and hope one day will come here again.
Keep up the good...More"
rn366537503,"Reviewed April 23, 2016 ", Kata Beach,Red Corner,"Had a wonderful meal here,The fish is fres and you can choose what you want to do the fish. The staff is very very friendly <f0><U+009F><U+0098><U+008D><f0><U+009F><U+0098><U+008D>. I. Love this cafe. <f0><U+009F><U+0098><U+009A><f0><U+009F><U+0098><U+009A>"
rn364159858,"Reviewed April 14, 2016 ", Kata Beach,Red Corner,"We were looking for a place to have a dinner, when a lady offered us a menu. It is very lovely place, with very afordable prices, good cusine and very friendly staff. A beer was served with frozen glass, which was amazing. Foodwas delicious. We...More"
rn364005394,"Reviewed April 13, 2016 ", Kata Beach,Red Corner,Went there and it had a big clientele. It looked like a good place to eat. Ordered one dish and could not eat it. Not sure if it was what I ordered or a bad day for the cook. Would return to try something else.
rn358333925,"Reviewed March 24, 2016 ", Kata Beach,Red Corner,Excellent service. Very friendly & a wide range of choices on the menu. Awesome value for money! Will definitely be coming back here :)
rn358333815,"Reviewed March 24, 2016 ", Kata Beach,Red Corner,Good service. Good gravy :) free wifi. Great range of food. Friendly workers and you get free shakes!
rn357764194,"Reviewed March 23, 2016 ", Kata Beach,Red Corner,My family and I ate here yesterday and I had the best duck noodle soup I have ever had in my life let alone in Phuket. Exquisite. The stir fried garlic chicken and the pad Thai were also very good. It was relatively cheap compared...More
rn350497435,"Reviewed February 24, 2016 ", Kata Beach,Red Corner,"We loved this place! The staff were wond wonderful people and the place was cosy with interesting decorations.food was great too, especially for the price they charged for it"
rn349650310,"Reviewed February 21, 2016 ", Kata Beach,Red Corner,Very tasty and good service . We will come back again for our excellent meal every time when we in Phuket the restaurant is look clean . And need not long time for food
rn579668363,Reviewed 1 week ago , Kata Beach,Red Corner,This place gives you the family feeling beautiful. Place. The best food. Love it. I always come back 2 -10 ok my holliday. Si god and fresh for the holde familie <U+2764>
rn577252166,Reviewed 2 weeks ago , Kata Beach,Red Corner,Asparagus with shrimp very fresh and good and so is many other dishes. Nice place and beautiful flowers.
rn565768342,"Reviewed March 11, 2018 ", Kata Beach,Red Corner,"When the place is full it’ll take 40-50 min to wait after you placed the order. Food is good, fruits as a compliment in the end."
rn547571742,"Reviewed December 16, 2017 ", Kata Beach,Red Corner,"Eating out over 2 weeks, from the expensive to the cheap we found this place to have the best food and value for money. What a wonderful experience.
Everyone should give it a go, highly recommended."
rn546996618,"Reviewed December 13, 2017 ", Kata Beach,Red Corner,Can not say that it full filled the expectations after reading the good reviews. I have been in Thailand 20+ times and lived here for 2 years back in the days and this was not good. We here 7 people eating this time and ordering...More
rn544129869,"Reviewed November 29, 2017 ", Kata Beach,Red Corner,"Simple, tasty Thai food. Restaurant does not look fancy but don't be put off. The food is fresh and full of flavour. We went back for a second time as it was so good! Can highly recommend the steamed fish with lime and chilli, yum!...More"
rn542759285,"Reviewed November 22, 2017 ", Kata Beach,Red Corner,"We went to this restaurant a few times - I confess we mainly went for the cheap drinks, 60 baht mojitos !
The staff were friendly, the drinks took awhile from order to table. So if you want more, order quick!
The restaurant was always...More"
rn531358602,"Reviewed October 9, 2017 ", Kata Beach,Red Corner,"Seriously the best meals and best value we have eaten over the past two weeks . Two full thumbs up. Cheap ice cold beer , fresh seafood. Best flavor, and really friendly"
rn521105484,"Reviewed September 4, 2017 ", Kata Beach,Red Corner,"We visited this restaurant based on the good review posted on TA, and they have proved to match their ratings, waiter guy was extra helpful which is hard to come by in most restaurants here and the food was very good! Will definitely recommend."
rn520482809,"Reviewed September 2, 2017 ", Kata Beach,Red Corner,I was here twice and I am really happy. The food was tasty and the price was good too. I am sure I will come back. The grilled food and tom yum are the top of restaurant.
rn579668363,Reviewed 1 week ago , Kata Beach,Red Corner,This place gives you the family feeling beautiful. Place. The best food. Love it. I always come back 2 -10 ok my holliday. Si god and fresh for the holde familie <U+2764>
rn577252166,Reviewed 2 weeks ago , Kata Beach,Red Corner,Asparagus with shrimp very fresh and good and so is many other dishes. Nice place and beautiful flowers.
rn565768342,"Reviewed March 11, 2018 ", Kata Beach,Red Corner,"When the place is full it’ll take 40-50 min to wait after you placed the order. Food is good, fruits as a compliment in the end."
rn547571742,"Reviewed December 16, 2017 ", Kata Beach,Red Corner,"Eating out over 2 weeks, from the expensive to the cheap we found this place to have the best food and value for money. What a wonderful experience.
Everyone should give it a go, highly recommended."
rn546996618,"Reviewed December 13, 2017 ", Kata Beach,Red Corner,Can not say that it full filled the expectations after reading the good reviews. I have been in Thailand 20+ times and lived here for 2 years back in the days and this was not good. We here 7 people eating this time and ordering...More
rn544129869,"Reviewed November 29, 2017 ", Kata Beach,Red Corner,"Simple, tasty Thai food. Restaurant does not look fancy but don't be put off. The food is fresh and full of flavour. We went back for a second time as it was so good! Can highly recommend the steamed fish with lime and chilli, yum!...More"
rn542759285,"Reviewed November 22, 2017 ", Kata Beach,Red Corner,"We went to this restaurant a few times - I confess we mainly went for the cheap drinks, 60 baht mojitos !
The staff were friendly, the drinks took awhile from order to table. So if you want more, order quick!
The restaurant was always...More"
rn531358602,"Reviewed October 9, 2017 ", Kata Beach,Red Corner,"Seriously the best meals and best value we have eaten over the past two weeks . Two full thumbs up. Cheap ice cold beer , fresh seafood. Best flavor, and really friendly"
rn521105484,"Reviewed September 4, 2017 ", Kata Beach,Red Corner,"We visited this restaurant based on the good review posted on TA, and they have proved to match their ratings, waiter guy was extra helpful which is hard to come by in most restaurants here and the food was very good! Will definitely recommend."
rn520482809,"Reviewed September 2, 2017 ", Kata Beach,Red Corner,I was here twice and I am really happy. The food was tasty and the price was good too. I am sure I will come back. The grilled food and tom yum are the top of restaurant.
rn579668363,Reviewed 1 week ago , Kata Beach,Red Corner,This place gives you the family feeling beautiful. Place. The best food. Love it. I always come back 2 -10 ok my holliday. Si god and fresh for the holde familie <U+2764>
rn577252166,Reviewed 2 weeks ago , Kata Beach,Red Corner,Asparagus with shrimp very fresh and good and so is many other dishes. Nice place and beautiful flowers.
rn565768342,"Reviewed March 11, 2018 ", Kata Beach,Red Corner,"When the place is full it’ll take 40-50 min to wait after you placed the order. Food is good, fruits as a compliment in the end."
rn547571742,"Reviewed December 16, 2017 ", Kata Beach,Red Corner,"Eating out over 2 weeks, from the expensive to the cheap we found this place to have the best food and value for money. What a wonderful experience.
Everyone should give it a go, highly recommended."
rn546996618,"Reviewed December 13, 2017 ", Kata Beach,Red Corner,Can not say that it full filled the expectations after reading the good reviews. I have been in Thailand 20+ times and lived here for 2 years back in the days and this was not good. We here 7 people eating this time and ordering...More
rn544129869,"Reviewed November 29, 2017 ", Kata Beach,Red Corner,"Simple, tasty Thai food. Restaurant does not look fancy but don't be put off. The food is fresh and full of flavour. We went back for a second time as it was so good! Can highly recommend the steamed fish with lime and chilli, yum!...More"
rn542759285,"Reviewed November 22, 2017 ", Kata Beach,Red Corner,"We went to this restaurant a few times - I confess we mainly went for the cheap drinks, 60 baht mojitos !
The staff were friendly, the drinks took awhile from order to table. So if you want more, order quick!
The restaurant was always...More"
rn531358602,"Reviewed October 9, 2017 ", Kata Beach,Red Corner,"Seriously the best meals and best value we have eaten over the past two weeks . Two full thumbs up. Cheap ice cold beer , fresh seafood. Best flavor, and really friendly"
rn521105484,"Reviewed September 4, 2017 ", Kata Beach,Red Corner,"We visited this restaurant based on the good review posted on TA, and they have proved to match their ratings, waiter guy was extra helpful which is hard to come by in most restaurants here and the food was very good! Will definitely recommend."
rn520482809,"Reviewed September 2, 2017 ", Kata Beach,Red Corner,I was here twice and I am really happy. The food was tasty and the price was good too. I am sure I will come back. The grilled food and tom yum are the top of restaurant.
rn579668363,Reviewed 1 week ago , Kata Beach,Red Corner,This place gives you the family feeling beautiful. Place. The best food. Love it. I always come back 2 -10 ok my holliday. Si god and fresh for the holde familie <U+2764>
rn577252166,Reviewed 2 weeks ago , Kata Beach,Red Corner,Asparagus with shrimp very fresh and good and so is many other dishes. Nice place and beautiful flowers.
rn565768342,"Reviewed March 11, 2018 ", Kata Beach,Red Corner,"When the place is full it’ll take 40-50 min to wait after you placed the order. Food is good, fruits as a compliment in the end."
rn547571742,"Reviewed December 16, 2017 ", Kata Beach,Red Corner,"Eating out over 2 weeks, from the expensive to the cheap we found this place to have the best food and value for money. What a wonderful experience.
Everyone should give it a go, highly recommended."
rn546996618,"Reviewed December 13, 2017 ", Kata Beach,Red Corner,Can not say that it full filled the expectations after reading the good reviews. I have been in Thailand 20+ times and lived here for 2 years back in the days and this was not good. We here 7 people eating this time and ordering...More
rn544129869,"Reviewed November 29, 2017 ", Kata Beach,Red Corner,"Simple, tasty Thai food. Restaurant does not look fancy but don't be put off. The food is fresh and full of flavour. We went back for a second time as it was so good! Can highly recommend the steamed fish with lime and chilli, yum!...More"
rn542759285,"Reviewed November 22, 2017 ", Kata Beach,Red Corner,"We went to this restaurant a few times - I confess we mainly went for the cheap drinks, 60 baht mojitos !
The staff were friendly, the drinks took awhile from order to table. So if you want more, order quick!
The restaurant was always...More"
rn531358602,"Reviewed October 9, 2017 ", Kata Beach,Red Corner,"Seriously the best meals and best value we have eaten over the past two weeks . Two full thumbs up. Cheap ice cold beer , fresh seafood. Best flavor, and really friendly"
rn521105484,"Reviewed September 4, 2017 ", Kata Beach,Red Corner,"We visited this restaurant based on the good review posted on TA, and they have proved to match their ratings, waiter guy was extra helpful which is hard to come by in most restaurants here and the food was very good! Will definitely recommend."
rn520482809,"Reviewed September 2, 2017 ", Kata Beach,Red Corner,I was here twice and I am really happy. The food was tasty and the price was good too. I am sure I will come back. The grilled food and tom yum are the top of restaurant.
rn578783890,Reviewed 1 week ago , Kata Beach,Horn Grill Steak and Seafood,"Friendly staff, really great food, live music which we enjoyed. Location is excellent. Will visit again and again."
rn575334806,Reviewed 3 weeks ago , Kata Beach,Horn Grill Steak and Seafood,Think I just had the best lamb shank I’ve ever eaten<f0><U+009F><U+00A4><U+00AF> and I’m from NZ so I know a good lamb shank. My girlfriend had the angus tenderloin with garlic butter sauce and she would rate it 6 stars if she could<f0><U+009F><U+0098><U+0082>. Great staff great...More
rn574879957,Reviewed 4 weeks ago , Kata Beach,Horn Grill Steak and Seafood,"THIS IS NOT A CHILDREN FRIENDLY RESTAURANT, ANYONE WITH BABIES PLS STOP YOUR FOOT! 1,sink is very high how a child can wash hand? 2,nothing plastic for babies which means while you eating you have to pay attention on your children and if it's broken...More"
rn574280807,Reviewed 4 weeks ago , Kata Beach,Horn Grill Steak and Seafood,We were all craving some meat so found this place on trip advisor. We were not very adventurous and all had burgers and chips and was lovely.
rn573395756,Reviewed 5 weeks ago , Kata Beach,Horn Grill Steak and Seafood,"We are a big group 7 adults to kinds, and love good food, The Horn is always a happy target, but hope to get my money back. They charged me twice the same amount fore the food, so be alert.More"
rn572310286,"Reviewed April 9, 2018 ", Kata Beach,Horn Grill Steak and Seafood,"Arrived 7.30 no booking required as not busy although filled up during the course of the evening. We both had steaks and cooked well and tasty, good price. Limited sides but these can be ordered separately. Had good Prosecco (1100 Bht). Apple cake with Ice...More"
rn570762001,"Reviewed April 3, 2018 ", Kata Beach,Horn Grill Steak and Seafood,"The place to go for steaks all served with your choice of sauce and fresh vegetables , best to book as it gets full !"
rn570575714,"Reviewed April 2, 2018 ", Kata Beach,Horn Grill Steak and Seafood,"My husband said his steak was excellent. My eldest son and I had the ribs, which whilst were incredibly tasty and well cooked, there really wasn't a lot of meat on them.
Staff were a bit of hard work and looked unhappy. They did seem...More"
rn570457438,"Reviewed April 2, 2018 ", Kata Beach,Horn Grill Steak and Seafood,We ate lamb and bluecheese chicken. Both dishes were excellent. Service were kind and professional. Prizes are higher than average.
rn568589172,"Reviewed March 25, 2018 ", Kata Beach,Horn Grill Steak and Seafood,"Trough the past 4 years we have visited Horn Grill in Kata on our yearly trip to Phuket, but this year was different, and NOT for the better.
The place looks “run down”, the staff are much less enthusiastic and the food is now average...More"
rn568359028,"Reviewed March 23, 2018 ", Kata Beach,Horn Grill Steak and Seafood,"We ate here twice and loved it the first time, however, the second time we were very dissapointed in the food and service. My husband chose the garlic pepper squid which in the photo looked like it was crispy deep fried squid when it came...More"
rn567811450,"Reviewed March 20, 2018 ", Kata Beach,Horn Grill Steak and Seafood,"food taste was very nice and friendly staff. If I visit Kata beach again, this place will be one of my selection."
rn566125541,"Reviewed March 12, 2018 ", Kata Beach,Horn Grill Steak and Seafood,"We had delicious starters to share but it stopped there. Main course not as impressive, lots of flavour but tough meat. Would return for light bites but not a full course."
rn566013678,"Reviewed March 12, 2018 ", Kata Beach,Horn Grill Steak and Seafood,Very attentive staff and the food can go from a plate of chips up to a three course meal and wine. There is also the option to sit outside or sit in the a/c dining room.
rn563823442,"Reviewed March 2, 2018 ", Kata Beach,Horn Grill Steak and Seafood,"Wanted to take a late but short Dinner and went there from Mom Tri's by foot.
Happy about that, because they have all you need and like to eat.
Beautiful and friendly Staff, Ladies bring great and delicious food 4 you.
Take an Icecream after...More"
rn562021420,"Reviewed February 21, 2018 ", Kata Beach,Horn Grill Steak and Seafood,The tenderloin was very nice and well prepared (proper medium rare). The pork was really tasty and the Thai dishes were also really good. Service was good all evening.
rn560233398,"Reviewed February 13, 2018 ", Kata Beach,Horn Grill Steak and Seafood,"This is the big reason why we should not believe the reviews on TripAdviser.
I've been here for dinner tonight with my wife and 6 years old son.
I ordered Steak platters and Carbonara. Here are my main thoughts about this restaurant.
1. 'Expensiveness'
This...More"
rn559715427,"Reviewed February 10, 2018 ", Kata Beach,Horn Grill Steak and Seafood,"We ate here twice during our stay.
On both occasions, the service was friendly and attentive and our food was served on time.
We all enjoyed our meals!
Our starters were nice, the spring rolls and sauce are really tasty.
The steaks are lovely; we...More"
rn557716739,"Reviewed February 1, 2018 ", Kata Beach,Horn Grill Steak and Seafood,"we had spicy calamari as a starter which was amazing, main dishes were pizza and pinaple rice both were pretty delicious, oly the service is a little slow. highly recommended overall!"
rn557310986,"Reviewed January 30, 2018 ", Kata Beach,Horn Grill Steak and Seafood,"We are there 4 times during our 9 day stay, all the food was great. We ate shrimp, calamari, salmon, burger. Only the burger could be better (the sauce was served on the side and was a bit dry because of it). Apart from the...More"
rn555547991,"Reviewed January 22, 2018 ", Kata Beach,Horn Grill Steak and Seafood,"Fantastic food and a really friendly atmosphere. The staff were excellent and more importantly so was the food. Would highly recommend, if you are in or close to Kata give it a try :)"
